year,session,course,description,scheduled_hours,class_size,lectures,tutorials,labs,other,institution_user_id
2016,Winter,TEST 168,Hope practice agency matter world.,36,133,20,17,3,1,61b42b56-4a5c-489d-a0c7-ad8afd8ce85b
2017,Winter,TEST 280,Those at your film detail magazine.,21,59,18,11,17,8,271370d8-7cb1-41f8-962f-f9bb65455d2f
2012,Summer,TEST 426,Issue old ok business serve enjoy east.,46,114,19,4,17,1,f474eae3-01b4-49c3-bae9-4f02674077fe
2012,Summer,TEST 280,Can sea deep hard rule answer citizen.,31,23,20,9,6,1,59ae2bd5-2468-4dcd-acb4-3f59978048ce
2023,Winter,TEST 238,Employee section thus trade prevent wall enjoy.,50,187,15,14,0,10,0f4bbb60-a954-4902-9642-29eaf3d83bf5
2014,Fall,TEST 445,Yet bed police save almost oil.,42,135,19,6,8,3,2387dbe3-8c45-4bfb-a648-2cb4819e3d4d
2018,Winter,TEST 266,Age structure best.,36,108,14,5,15,6,2ce002f9-64c8-4930-918b-75bbd401a5f5
2024,Summer,TEST 173,Word rule interest majority him.,24,93,13,4,15,6,d09441e8-6d2c-4d62-aa9d-fbe4f4b35165
2016,Summer,TEST 355,Among glass see.,34,32,15,0,18,0,97ad4dc4-795b-4620-88b0-a7f5b0c7d189
2021,Fall,TEST 276,Level job hair party need series.,23,153,15,15,0,1,11b596a8-de1a-43e0-9084-60eaa5a7462e
2013,Summer,TEST 134,Financial speak apply later month article.,34,45,13,19,12,7,6eda1942-6012-4f90-8c0c-66780487e9eb
2022,Winter,TEST 255,Seven reach usually.,29,55,15,8,16,7,ba1d9c49-f6f8-4052-8245-dff2d2e76da6
2016,Fall,TEST 205,Picture hit behavior million.,40,61,12,17,17,9,acf2bf98-8281-4d34-b4d7-45cc0aece8e2
2013,Summer,TEST 462,Probably answer wide seem.,30,197,16,5,1,0,8262b34e-865d-4d29-8c84-4d4a564d4025
2011,Summer,TEST 327,However town them.,20,30,13,7,18,6,a4826d9c-7390-4093-bbbe-4ccc877f3c99
2020,Fall,TEST 164,Doctor pretty budget part.,46,194,11,12,9,9,83da2a00-9e59-4a61-b24e-d249d9105838
2012,Winter,TEST 173,Support themselves leg draw plan fire would.,37,128,18,7,17,2,4949a93b-73d6-4a82-8fd4-225c5fe9b733
2022,Fall,TEST 134,While gun economy everybody say eye manage past.,42,169,14,12,18,0,a5b8b679-0ad3-4e93-a6ee-aadeb295dcd0
2011,Fall,TEST 448,Follow appear agent continue environmental high on.,28,136,20,14,8,7,5ea336fa-00a7-4f55-9b97-385c8de5b27b
2014,Fall,TEST 153,Yeah fear coach sometimes instead street particularly.,41,108,14,11,11,7,acf2bf98-8281-4d34-b4d7-45cc0aece8e2
2021,Summer,TEST 347,However onto stage try drop writer time.,45,142,11,3,19,0,c428ffc8-0be7-413c-8018-c56e60dcd2f2
2016,Summer,TEST 237,Investment deep itself state.,21,25,14,14,19,8,bc1e08bb-ab1a-4db2-ae17-9426a17b12f2
2019,Summer,TEST 449,Camera we sure middle major care box.,34,126,19,0,20,2,2284d901-1196-47b3-a671-846565d2e68d
2020,Summer,TEST 281,Maybe picture page newspaper manager.,48,180,15,7,14,6,3be48124-ddec-4b5d-9b7d-8e6dfb03f474
2024,Summer,TEST 360,Development pick computer record material marriage.,22,85,10,11,6,10,8623e081-d699-4413-81ff-b940255b91d8
2018,Summer,TEST 253,Continue everybody miss office.,21,98,18,15,11,8,834964bb-76ac-4773-9bed-ed2479b2b798
2012,Winter,TEST 394,Nature about approach cost no.,38,83,13,19,13,1,cf46a12f-66d6-457b-bf55-91721a00dcb2
2023,Fall,TEST 226,Magazine happen begin he cold.,31,24,14,6,0,10,2387dbe3-8c45-4bfb-a648-2cb4819e3d4d
2014,Winter,TEST 484,Several knowledge network build network perform.,34,137,17,6,3,8,d18c501a-89ed-4fa7-83cf-c1e6e35e857e
2014,Fall,TEST 161,House about image response.,29,37,15,6,4,3,2bbf0d0d-7bec-4e0e-8e41-360aaea6a27c
2010,Fall,TEST 459,War event thought recognize news state size.,42,151,16,1,8,9,e6c77cd1-e7af-4607-b26a-01225180fd47
2019,Fall,TEST 260,Result man simple night parent.,38,136,13,7,1,4,4ee202d5-0f76-4f9a-b8f9-d554c6871d04
2023,Winter,TEST 409,Generation prepare interview.,35,21,12,3,14,8,e562c952-48e0-49bb-98af-1140a4aa5ca2
2013,Fall,TEST 348,Author me address head building could.,33,130,13,20,1,8,2993c7d1-e7e3-41d0-b396-50174166eed4
2023,Summer,TEST 206,House quite south eight argue space trial.,27,80,12,9,6,5,d7e3fbaf-a813-46f2-a10e-0e0c91a97dbd
2020,Fall,TEST 358,Avoid Congress stuff respond job.,40,192,18,15,17,2,2bbf0d0d-7bec-4e0e-8e41-360aaea6a27c
2024,Winter,TEST 493,Pretty be garden meet west let.,27,74,14,6,16,1,a65c6f8f-44cb-4fab-8929-a5ff8a16fac0
2023,Fall,TEST 189,Garden evening floor bar future.,49,87,14,15,4,2,a5b8b679-0ad3-4e93-a6ee-aadeb295dcd0
2022,Winter,TEST 352,Herself western guess develop send cause.,27,119,20,11,5,10,f7cd816d-09ac-453c-abfb-ee530de9065f
2020,Fall,TEST 374,One less opportunity carry they stuff any.,49,78,15,11,3,10,92496868-3958-4208-bf7c-f3a023dfa719
2010,Summer,TEST 445,Away process series board at fall process lead.,20,40,14,4,12,1,0f4bbb60-a954-4902-9642-29eaf3d83bf5
2015,Winter,TEST 314,Into test marriage who feeling list.,47,167,16,9,16,9,153a8a5f-8183-48f1-9a10-e8cb62428a99
2013,Fall,TEST 426,Back real light large reason record.,22,118,20,8,6,2,d5ef87a1-3153-401d-b926-75f0db87d229
2021,Fall,TEST 287,Board me lose oil health whether realize.,39,75,11,6,20,4,8d5f786f-ecf5-4f27-9292-f2ade3a83ed2
2014,Winter,TEST 273,Change couple we.,30,162,16,14,17,2,d2d8715e-f726-472d-a8ad-046e596c0c96
2024,Fall,TEST 231,Know occur impact entire discover class affect.,40,66,11,10,9,8,f331313b-b9f4-4685-bc5b-759c96757b76
2015,Summer,TEST 356,Vote world evening officer about five.,35,200,17,13,3,4,bc1e08bb-ab1a-4db2-ae17-9426a17b12f2
2023,Summer,TEST 444,Mission office good city born site strategy.,49,48,11,8,1,1,01656dd2-c78a-4347-b311-4e227ed3b630
2020,Summer,TEST 120,Than accept he property human painting hold very.,22,57,18,8,16,5,071a6936-acc0-493e-9e29-51839b052706
2018,Summer,TEST 359,Stuff authority risk.,43,27,16,1,7,0,be9a0ec3-ebe0-4bd2-8f1a-74efd66170c7
2016,Summer,TEST 129,Idea citizen just away.,40,193,17,19,18,3,01656dd2-c78a-4347-b311-4e227ed3b630
2018,Winter,TEST 165,Lose ever development purpose wrong nothing.,33,176,20,20,0,9,e562c952-48e0-49bb-98af-1140a4aa5ca2
2021,Winter,TEST 295,Break almost report continue enough imagine center.,37,139,13,8,17,4,fb20e84e-e33d-4ea3-984d-29e6d4543028
2024,Winter,TEST 111,Draw debate majority mouth.,29,72,20,18,9,4,d09441e8-6d2c-4d62-aa9d-fbe4f4b35165
2012,Summer,TEST 208,Beat act ahead condition.,43,20,11,19,5,2,1e5cad76-2680-4b2f-8830-79059aaef871
2015,Winter,TEST 152,Quality chance their production she.,46,29,12,16,2,1,43a69526-3b10-4b41-a1b3-4d3c69007acb
2012,Fall,TEST 457,Professional environment support.,40,150,16,7,8,10,8262b34e-865d-4d29-8c84-4d4a564d4025
2017,Summer,TEST 281,Produce baby itself night.,30,179,10,10,2,8,ec0a2f29-b706-476b-93c2-c78db7837186
2014,Winter,TEST 222,Part no check past worry choice benefit.,43,121,19,10,18,3,8262b34e-865d-4d29-8c84-4d4a564d4025
2022,Summer,TEST 436,Teach challenge together every actually gun receive.,45,149,10,19,12,0,2387dbe3-8c45-4bfb-a648-2cb4819e3d4d
2017,Summer,TEST 259,Child study player close.,42,128,17,15,2,3,e6c77cd1-e7af-4607-b26a-01225180fd47
2023,Fall,TEST 454,Become sing hospital bag hundred detail compare.,36,40,15,10,20,4,ad7b82f5-8476-4077-90df-2b38738c1fa5
2019,Fall,TEST 413,Word company mission save agree treat.,27,89,19,5,7,4,e44eeccb-8db9-41b5-af11-9c107600d5b0
2011,Fall,TEST 146,Air television film contain only time our.,46,168,15,6,10,10,503261e4-fbcb-4003-a615-82ae2cbf7344
2019,Winter,TEST 215,Clear value ok religious.,45,68,18,19,18,3,fb20e84e-e33d-4ea3-984d-29e6d4543028
2013,Summer,TEST 152,Child you and ahead personal.,49,32,14,18,6,10,1e5cad76-2680-4b2f-8830-79059aaef871
2018,Fall,TEST 407,Foot nor fish especially.,43,185,19,12,15,6,2bbf0d0d-7bec-4e0e-8e41-360aaea6a27c
2019,Summer,TEST 183,Read nothing coach enough respond.,45,113,11,0,13,2,5ce636b5-f47b-4e4a-abff-31102f046718
2010,Fall,TEST 473,Among direction prevent skill compare party draw.,29,81,10,9,3,4,67bdd6c3-6ecf-422c-8441-2e35679c5b7f
2010,Fall,TEST 303,Young different improve place medical who.,50,191,18,17,9,1,ba1d9c49-f6f8-4052-8245-dff2d2e76da6
2021,Summer,TEST 204,People music career grow present reflect.,25,90,10,8,20,2,61b42b56-4a5c-489d-a0c7-ad8afd8ce85b
2023,Summer,TEST 186,Single also power white beyond likely.,50,66,16,7,9,2,503261e4-fbcb-4003-a615-82ae2cbf7344
2012,Winter,TEST 273,Realize or build magazine down always nothing.,26,64,18,17,4,7,2284d901-1196-47b3-a671-846565d2e68d
2024,Summer,TEST 401,Program hospital well beyond.,26,101,10,13,15,0,3ff4b31b-8b70-42d8-be05-6b2095fa7f6e
2020,Summer,TEST 432,General between can race rest return word.,38,44,18,16,15,1,e6c77cd1-e7af-4607-b26a-01225180fd47
2011,Fall,TEST 155,Speak tonight relationship score reach.,28,34,14,19,19,7,acf2bf98-8281-4d34-b4d7-45cc0aece8e2
2011,Winter,TEST 144,Choose subject attack hold really than career.,27,144,11,6,6,10,3ff4b31b-8b70-42d8-be05-6b2095fa7f6e
2011,Fall,TEST 233,Television community during door east improve.,33,158,18,0,4,6,d54d6a80-9e64-411a-b49a-06539eeaed27
2024,Summer,TEST 213,Hear method want read per course fly recent.,45,23,20,1,11,3,a5b8b679-0ad3-4e93-a6ee-aadeb295dcd0
2022,Fall,TEST 247,True his form last.,32,77,16,20,4,0,5ce636b5-f47b-4e4a-abff-31102f046718
2023,Fall,TEST 193,Discuss surface beautiful popular.,35,93,14,16,6,9,f82052d4-6608-4bb0-8e0b-60ae0babdfde
2021,Winter,TEST 125,Citizen often on stop science.,25,81,17,14,2,5,071a6936-acc0-493e-9e29-51839b052706
2014,Summer,TEST 305,Available produce base.,38,99,11,9,1,5,ad7b82f5-8476-4077-90df-2b38738c1fa5
2023,Fall,TEST 396,Own glass guy nation.,29,197,13,16,19,7,11b596a8-de1a-43e0-9084-60eaa5a7462e
2020,Fall,TEST 215,Down government practice effort bring.,24,23,12,19,12,5,be9a0ec3-ebe0-4bd2-8f1a-74efd66170c7
2017,Summer,TEST 169,Claim that magazine here head ready girl ability.,50,121,15,5,2,7,00bd929e-0b84-47d5-acbe-b3825655521f
2011,Summer,TEST 408,Day figure yard everyone major kind region painting.,44,163,14,5,1,4,8262b34e-865d-4d29-8c84-4d4a564d4025
2017,Summer,TEST 241,Traditional Congress also million mother probably.,40,35,14,0,7,3,14381058-aab2-44e8-a3db-b5872d7de104
2017,Summer,TEST 381,Charge number seek.,50,39,15,8,0,5,93529fbb-3d3b-45e7-a7c3-03e00a1e5352
2016,Fall,TEST 149,Call blood almost scene.,48,93,11,0,13,7,8262b34e-865d-4d29-8c84-4d4a564d4025
2016,Winter,TEST 417,Pull almost produce card radio scene special.,33,65,16,10,8,4,d9d400ec-2ca5-492d-81c5-3da577483bd5
2018,Summer,TEST 247,Sell visit group address.,36,140,10,16,19,9,7d325df4-375f-44ee-b72a-0aa097519980
2024,Fall,TEST 143,Free board gas.,32,111,15,17,0,8,d2d8715e-f726-472d-a8ad-046e596c0c96
2013,Winter,TEST 469,Source growth help yeah around return.,32,22,18,0,1,3,d5ef87a1-3153-401d-b926-75f0db87d229
2019,Fall,TEST 474,Cup my woman close responsibility good.,22,124,15,0,13,4,11b596a8-de1a-43e0-9084-60eaa5a7462e
2011,Summer,TEST 106,Take book scene popular.,24,25,10,19,11,0,2ce002f9-64c8-4930-918b-75bbd401a5f5
2020,Fall,TEST 181,Decision recent activity change in medical establish.,42,176,17,1,16,8,071a6936-acc0-493e-9e29-51839b052706
2012,Fall,TEST 330,Bag your wife such.,38,58,19,7,0,8,393b08f1-44d1-4ec9-a1eb-c009b117b1c7
2024,Winter,TEST 136,Fund source under pretty.,45,172,11,13,9,6,2284d901-1196-47b3-a671-846565d2e68d
2012,Summer,TEST 479,Hour system call actually fear condition generation.,46,134,13,20,10,0,14381058-aab2-44e8-a3db-b5872d7de104
2018,Fall,TEST 178,Building professional everything.,35,141,15,1,7,0,e6c77cd1-e7af-4607-b26a-01225180fd47
2018,Summer,TEST 498,Popular three none cause learn new enough.,40,83,15,1,3,0,2bfac3a6-a926-44c8-a080-a1b72c0ffe50
2020,Fall,TEST 397,Mind out something simply guy free American.,46,153,19,18,7,4,02a4d835-35dd-471b-b5b2-f9b4d21744ea
2016,Summer,TEST 277,Week life talk some window interest spend.,30,35,19,17,3,10,2821e714-8d12-4cda-a5e3-30ece56d6d15
2023,Fall,TEST 256,Move return five south.,25,118,19,20,9,10,061e3efe-6b6d-46b4-997d-914f6bcc4590
2010,Fall,TEST 164,Between look over industry green board.,20,40,16,5,20,4,c428ffc8-0be7-413c-8018-c56e60dcd2f2
2011,Fall,TEST 147,Own project suffer common.,46,148,13,11,16,10,43a69526-3b10-4b41-a1b3-4d3c69007acb
2017,Summer,TEST 267,Charge business follow animal stay mind.,36,196,17,11,13,3,11984d52-b791-4cf9-8c79-bc0d21a8a183
2018,Summer,TEST 453,Think support democratic loss company subject beat.,26,136,20,15,0,3,93529fbb-3d3b-45e7-a7c3-03e00a1e5352
2023,Winter,TEST 156,Often mean single including.,28,29,11,12,1,1,61b42b56-4a5c-489d-a0c7-ad8afd8ce85b
2010,Summer,TEST 348,Win call still by many save.,37,49,13,5,13,3,cf46a12f-66d6-457b-bf55-91721a00dcb2
2018,Summer,TEST 231,Heart Mrs nice around bit.,49,46,12,15,13,5,5ce636b5-f47b-4e4a-abff-31102f046718
2015,Winter,TEST 119,Number night really mean mouth many better.,40,23,18,2,6,7,f7cd816d-09ac-453c-abfb-ee530de9065f
2020,Winter,TEST 196,Perhaps task bag vote him create.,28,42,13,19,3,1,e91a7fa5-786a-4300-806b-6f95cad12de5
2019,Fall,TEST 408,Sit maintain north change.,21,42,11,9,9,3,ec0a2f29-b706-476b-93c2-c78db7837186
2011,Fall,TEST 495,Democratic sound seven about.,30,72,18,11,1,2,2bfac3a6-a926-44c8-a080-a1b72c0ffe50
2016,Summer,TEST 173,Career environment ok ready.,23,124,11,17,14,7,a5b8b679-0ad3-4e93-a6ee-aadeb295dcd0
2012,Winter,TEST 326,Change herself of drive.,39,43,17,19,0,5,e4f620fd-ee1f-4635-b51b-32758f0df015
2013,Winter,TEST 242,Summer task class million daughter good debate.,31,53,18,20,5,4,2284d901-1196-47b3-a671-846565d2e68d
2023,Winter,TEST 282,Only arrive remember media government.,28,108,20,12,5,5,08db5c58-4803-46e9-89bf-5abb1bd1541d
2023,Winter,TEST 314,Guess coach increase.,38,65,14,8,1,6,2bfac3a6-a926-44c8-a080-a1b72c0ffe50
2017,Fall,TEST 190,Guy and money model.,43,147,12,5,0,3,cca89a93-b946-46e3-aa1b-07b1bad86a29
2011,Winter,TEST 241,Believe risk forget establish majority its.,21,68,15,16,18,7,97ad4dc4-795b-4620-88b0-a7f5b0c7d189
2013,Summer,TEST 231,Newspaper very many institution small firm fear occur.,49,66,11,1,12,1,11b596a8-de1a-43e0-9084-60eaa5a7462e
2019,Fall,TEST 210,May lay ability when four would nearly.,43,70,12,20,0,1,59ae2bd5-2468-4dcd-acb4-3f59978048ce
2011,Winter,TEST 364,Everything level let these exactly minute.,24,110,18,19,15,4,927da48c-edf6-426a-add0-fe00b623f2de
2021,Summer,TEST 498,Stop gas pretty human whose tax.,38,128,13,10,12,2,fb20e84e-e33d-4ea3-984d-29e6d4543028
2010,Winter,TEST 235,Factor consumer stage down send song himself.,24,124,12,9,5,2,4eb301f3-8119-4780-bf91-98a973daf4b3
2021,Summer,TEST 168,Heavy itself yeah arm for.,41,191,13,4,6,10,2387dbe3-8c45-4bfb-a648-2cb4819e3d4d
2021,Winter,TEST 151,Research day behavior night brother environment specific.,46,96,17,4,16,0,476007ed-f8e5-44d7-8d92-beebe2116b28
2022,Summer,TEST 183,Past western under ground hear government.,31,45,13,20,10,5,307829f3-8ecc-44e4-bad0-ac7c39c6bf71
2024,Winter,TEST 274,Live hotel me investment community serious contain.,47,76,13,12,11,9,00bd929e-0b84-47d5-acbe-b3825655521f
2023,Fall,TEST 465,Finally pull window feeling soon peace.,40,128,14,19,2,7,4b256945-d852-4fce-8702-c107423984fa
2010,Winter,TEST 340,Participant two write new.,37,136,18,12,11,6,029b473c-3479-4982-b114-286653b193cf
2016,Winter,TEST 423,Themselves perhaps risk either yes find.,41,198,13,14,5,9,f474eae3-01b4-49c3-bae9-4f02674077fe
2012,Fall,TEST 115,Draw data world when ready discover.,39,169,18,9,18,8,bc1e08bb-ab1a-4db2-ae17-9426a17b12f2
2010,Fall,TEST 392,Reduce care matter.,41,30,10,20,0,10,ec0a2f29-b706-476b-93c2-c78db7837186
2020,Winter,TEST 110,Data animal rich door yes tonight how true.,33,151,14,12,2,0,d18c501a-89ed-4fa7-83cf-c1e6e35e857e
2014,Winter,TEST 259,Big even now capital good address.,36,59,13,2,4,10,83da2a00-9e59-4a61-b24e-d249d9105838
2010,Fall,TEST 136,Anything myself issue movement debate safe.,32,76,14,17,16,6,c1dd3d29-4142-46b3-bac5-aadd6b5c1d7c
2024,Winter,TEST 257,East owner water statement commercial professor even.,35,86,12,9,11,0,a4826d9c-7390-4093-bbbe-4ccc877f3c99
2015,Fall,TEST 171,White hour chance lawyer open subject.,20,88,18,12,16,0,0f4bbb60-a954-4902-9642-29eaf3d83bf5
2017,Winter,TEST 282,Language history bring travel.,22,198,15,17,15,2,b20a6bc7-bc38-47e6-acbb-1d163140c7dc
2014,Fall,TEST 162,Sister individual view his reduce peace hope take.,32,28,12,0,6,2,d8758063-5849-407d-ab33-576b929a126a
2018,Winter,TEST 230,Quite policy ball popular course sense suggest.,45,179,18,0,5,5,6eda1942-6012-4f90-8c0c-66780487e9eb
2022,Summer,TEST 486,Decide into rise particularly with sit.,29,192,13,0,14,7,acf2bf98-8281-4d34-b4d7-45cc0aece8e2
2011,Winter,TEST 249,Election health protect brother weight.,21,141,19,2,11,3,d54d6a80-9e64-411a-b49a-06539eeaed27
2022,Winter,TEST 285,Any most program style tonight sound fight.,27,60,13,0,11,9,4a679633-c6fc-43f7-94c6-45919c3f94a3
2013,Summer,TEST 362,Crime ten probably service institution world miss finish.,29,95,19,9,11,3,2bbf0d0d-7bec-4e0e-8e41-360aaea6a27c
2021,Fall,TEST 370,Skill down term baby forget phone truth.,49,175,11,13,14,3,2821e714-8d12-4cda-a5e3-30ece56d6d15
2019,Fall,TEST 340,Card eye section significant director.,29,130,20,11,2,4,1cf806bf-f429-47b9-9ee9-551df06b0c3a
2010,Fall,TEST 129,Particular response official security.,32,186,18,11,9,9,a65c6f8f-44cb-4fab-8929-a5ff8a16fac0
2024,Winter,TEST 436,Commercial have key forward particularly contain Mr.,20,140,11,6,4,4,e44eeccb-8db9-41b5-af11-9c107600d5b0
2013,Winter,TEST 319,Particular when help something.,27,67,11,20,0,8,927da48c-edf6-426a-add0-fe00b623f2de
2022,Fall,TEST 166,Party that law room imagine hospital.,22,34,15,9,11,10,071a6936-acc0-493e-9e29-51839b052706
2012,Summer,TEST 435,Wrong everything southern social range rule imagine.,40,47,18,5,2,4,271370d8-7cb1-41f8-962f-f9bb65455d2f
2019,Winter,TEST 369,Picture food color against race central practice north.,24,143,13,13,0,2,9b717e18-4fd7-4609-a0cd-84a70aa55992
2024,Summer,TEST 348,Through and practice training produce join expert.,48,173,20,14,19,10,d42ff4e2-ec70-4062-9208-06b50e6bf4d5
2012,Winter,TEST 229,Mind focus set food partner despite idea.,42,94,12,3,9,0,97ad4dc4-795b-4620-88b0-a7f5b0c7d189
2020,Summer,TEST 400,Particularly issue area.,36,113,13,10,9,8,cca89a93-b946-46e3-aa1b-07b1bad86a29
2024,Fall,TEST 141,Century area week inside available.,26,137,20,4,7,8,c1dd3d29-4142-46b3-bac5-aadd6b5c1d7c
2022,Winter,TEST 391,Series learn image list actually president public.,37,132,13,18,19,1,8d5f786f-ecf5-4f27-9292-f2ade3a83ed2
2015,Winter,TEST 279,Catch top PM.,29,119,16,10,4,10,f82052d4-6608-4bb0-8e0b-60ae0babdfde
2013,Summer,TEST 312,Draw wonder effect try name.,43,55,18,9,1,3,cf46a12f-66d6-457b-bf55-91721a00dcb2
2017,Fall,TEST 215,Pay mission eye cold.,36,163,20,14,11,3,2387dbe3-8c45-4bfb-a648-2cb4819e3d4d
2018,Winter,TEST 247,Bag safe leg point sound listen sure.,25,126,19,20,2,10,cca89a93-b946-46e3-aa1b-07b1bad86a29
2014,Summer,TEST 264,Nice return language.,40,91,15,9,2,4,2bfac3a6-a926-44c8-a080-a1b72c0ffe50
2023,Fall,TEST 320,Until million experience choice arrive.,49,131,10,7,3,3,393b08f1-44d1-4ec9-a1eb-c009b117b1c7
2023,Summer,TEST 458,Move protect manage environmental approach tough.,45,53,12,17,12,2,c1dd3d29-4142-46b3-bac5-aadd6b5c1d7c
2022,Fall,TEST 250,Meet defense final drive budget.,24,198,10,9,14,7,c8f5b79b-10af-44f8-b430-6a6c655b5705
2019,Winter,TEST 410,View somebody business however head.,31,59,19,13,10,3,4ee202d5-0f76-4f9a-b8f9-d554c6871d04
2016,Summer,TEST 390,Anything law project poor move.,28,108,15,18,9,10,11b596a8-de1a-43e0-9084-60eaa5a7462e
2017,Fall,TEST 186,Laugh water between knowledge truth concern write staff.,20,68,11,6,10,7,393b08f1-44d1-4ec9-a1eb-c009b117b1c7
2022,Winter,TEST 394,Take something member.,45,117,17,5,11,4,1cf806bf-f429-47b9-9ee9-551df06b0c3a
2020,Summer,TEST 215,Back believe like.,45,125,14,13,16,5,c428ffc8-0be7-413c-8018-c56e60dcd2f2
2023,Fall,TEST 126,What white child occur get sport.,44,57,16,0,1,8,be9a0ec3-ebe0-4bd2-8f1a-74efd66170c7
2015,Fall,TEST 264,Mother pretty PM language stay language order.,43,94,11,12,2,1,8262b34e-865d-4d29-8c84-4d4a564d4025
2024,Winter,TEST 117,Manager role start card.,49,39,17,4,6,8,c1dd3d29-4142-46b3-bac5-aadd6b5c1d7c
2020,Fall,TEST 254,Surface doctor reveal season.,31,77,11,20,17,5,ad7b82f5-8476-4077-90df-2b38738c1fa5
2022,Summer,TEST 458,Consider including wife ten skin call.,47,29,19,20,19,0,5ea336fa-00a7-4f55-9b97-385c8de5b27b
2016,Summer,TEST 178,Standard south our parent night.,21,73,17,15,18,8,ba1d9c49-f6f8-4052-8245-dff2d2e76da6
2013,Winter,TEST 491,Decision city view skill maintain sound.,50,111,13,10,13,9,f474eae3-01b4-49c3-bae9-4f02674077fe
2021,Summer,TEST 246,Talk alone until.,47,154,12,5,10,1,61b42b56-4a5c-489d-a0c7-ad8afd8ce85b
2021,Fall,TEST 263,Rich none away feel.,25,136,15,13,13,6,4949a93b-73d6-4a82-8fd4-225c5fe9b733
2021,Winter,TEST 410,Answer own type from in which few.,40,77,11,15,7,3,ca5901d2-e274-44eb-8874-5fe3f8479462
2017,Fall,TEST 252,Already moment catch year glass Mrs direction.,35,162,17,13,16,5,b20a6bc7-bc38-47e6-acbb-1d163140c7dc
2018,Summer,TEST 187,Management carry after.,25,198,20,11,10,8,d7e3fbaf-a813-46f2-a10e-0e0c91a97dbd
2019,Fall,TEST 409,Major hard shoulder talk.,27,63,18,8,5,2,71db65c9-eb81-4647-b18f-991a75f22e62
2019,Winter,TEST 238,After worker low clearly need wall notice.,32,40,18,12,19,3,be9a0ec3-ebe0-4bd2-8f1a-74efd66170c7
2011,Winter,TEST 110,Development reality here forward two bad cost team.,30,177,20,14,20,0,153a8a5f-8183-48f1-9a10-e8cb62428a99
2012,Fall,TEST 446,Sometimes daughter billion result.,34,61,15,5,15,10,a65c6f8f-44cb-4fab-8929-a5ff8a16fac0
2014,Winter,TEST 247,High station consumer avoid.,25,138,19,13,18,4,153a8a5f-8183-48f1-9a10-e8cb62428a99
2015,Winter,TEST 298,Life necessary bit able organization hit why.,45,197,14,16,17,3,11b596a8-de1a-43e0-9084-60eaa5a7462e
2014,Fall,TEST 214,Respond direction team how.,43,135,19,4,8,7,01656dd2-c78a-4347-b311-4e227ed3b630
2015,Winter,TEST 205,Their ten apply top.,24,189,19,5,16,9,43a69526-3b10-4b41-a1b3-4d3c69007acb
2012,Summer,TEST 312,Begin population apply director.,24,141,10,17,1,8,5ea336fa-00a7-4f55-9b97-385c8de5b27b
2019,Winter,TEST 461,Central offer detail nearly whole newspaper right.,23,151,18,18,6,4,a850ec4e-32e0-4345-a838-5f97c6b5ed66
2019,Fall,TEST 443,Key night crime push.,33,43,15,1,11,0,d9d400ec-2ca5-492d-81c5-3da577483bd5
2022,Fall,TEST 288,Easy involve him turn else challenge everything.,43,146,13,14,0,6,17ccaf00-a3b1-4435-b126-03cc9d1db6a5
2017,Summer,TEST 301,No significant president game amount believe.,49,53,10,20,7,0,2284d901-1196-47b3-a671-846565d2e68d
2023,Winter,TEST 223,Those reach owner.,45,150,10,17,15,6,d5f46e4e-dc20-4747-9bcf-264e059c51ff
2014,Summer,TEST 394,Region character throw subject maintain environmental front wall.,38,50,10,11,8,1,c8f5b79b-10af-44f8-b430-6a6c655b5705
2023,Summer,TEST 217,Everybody will wife out.,23,36,11,10,0,1,d7e3fbaf-a813-46f2-a10e-0e0c91a97dbd
2021,Fall,TEST 384,Everyone head run on play generation.,27,109,12,20,1,6,2bbf0d0d-7bec-4e0e-8e41-360aaea6a27c
2019,Fall,TEST 278,Often class race other information amount respond.,33,131,19,1,5,2,6eda1942-6012-4f90-8c0c-66780487e9eb
2018,Fall,TEST 274,Explain note cell follow nearly provide.,24,53,11,14,18,5,02a4d835-35dd-471b-b5b2-f9b4d21744ea
2017,Summer,TEST 360,Summer available best rule find.,27,29,15,7,2,10,71db65c9-eb81-4647-b18f-991a75f22e62
2022,Winter,TEST 281,Work society teach yard yard.,46,171,16,15,10,10,153a8a5f-8183-48f1-9a10-e8cb62428a99
2011,Winter,TEST 199,Production full ok serve everybody.,39,181,10,8,9,9,d42ff4e2-ec70-4062-9208-06b50e6bf4d5
2018,Winter,TEST 396,Participant include single.,37,156,20,14,6,1,569cebda-64cc-4e0f-8c3b-b6d8af052b4c
2023,Summer,TEST 205,Industry however trouble both indeed environment them.,25,67,15,20,20,8,307829f3-8ecc-44e4-bad0-ac7c39c6bf71
2010,Summer,TEST 390,Return black food where medical option region.,36,122,11,11,19,0,5ea336fa-00a7-4f55-9b97-385c8de5b27b
2016,Winter,TEST 273,Clear choose stock perhaps same view Republican attack.,50,196,20,11,6,10,d9d400ec-2ca5-492d-81c5-3da577483bd5
2022,Fall,TEST 404,Food relate build billion do use region.,31,139,18,11,10,4,17ccaf00-a3b1-4435-b126-03cc9d1db6a5
2018,Winter,TEST 346,Month general quality music.,50,148,20,0,6,8,d5ef87a1-3153-401d-b926-75f0db87d229
2021,Summer,TEST 113,Popular finish cost or.,45,195,15,8,11,0,be9a0ec3-ebe0-4bd2-8f1a-74efd66170c7
2011,Fall,TEST 312,Soldier since again they.,34,60,12,9,20,10,927da48c-edf6-426a-add0-fe00b623f2de
2019,Summer,TEST 455,Million family budget product subject career food behind.,42,122,10,13,12,3,d5ef87a1-3153-401d-b926-75f0db87d229
2013,Summer,TEST 394,Child development shoulder certainly also result.,26,174,10,16,15,10,71e08604-4000-409c-ad67-0b70ab52399e
2010,Summer,TEST 310,Sing build be claim perhaps president minute.,33,29,12,14,2,4,d9d400ec-2ca5-492d-81c5-3da577483bd5
2015,Fall,TEST 232,Charge summer use wait arm edge.,49,175,11,2,13,10,6eda1942-6012-4f90-8c0c-66780487e9eb
2014,Summer,TEST 254,Star series skill.,26,177,20,14,18,4,d8758063-5849-407d-ab33-576b929a126a
2020,Summer,TEST 280,Today born simple fact rate.,24,188,15,4,15,3,d8758063-5849-407d-ab33-576b929a126a
2016,Summer,TEST 137,Suddenly far out dinner.,34,134,15,8,0,3,a4826d9c-7390-4093-bbbe-4ccc877f3c99
2013,Summer,TEST 125,Community notice risk form political.,30,76,16,17,15,8,d54d6a80-9e64-411a-b49a-06539eeaed27
2016,Fall,TEST 422,Image sister leader child three.,25,139,19,16,15,6,2821e714-8d12-4cda-a5e3-30ece56d6d15
2017,Fall,TEST 277,All set benefit wrong question effect expect end.,28,51,11,20,13,4,d2d8715e-f726-472d-a8ad-046e596c0c96
2016,Winter,TEST 183,Indicate foreign rock risk service authority.,43,193,18,3,19,7,97ad4dc4-795b-4620-88b0-a7f5b0c7d189
2019,Fall,TEST 324,Thousand practice to hope plan movement majority.,39,122,14,9,0,10,4b256945-d852-4fce-8702-c107423984fa
2013,Winter,TEST 201,Cause rather home return network huge.,27,48,15,6,14,7,503261e4-fbcb-4003-a615-82ae2cbf7344
2013,Fall,TEST 497,Front remain term consider certainly opportunity.,35,198,18,0,16,9,cf46a12f-66d6-457b-bf55-91721a00dcb2
2019,Winter,TEST 367,Site front else without real range ago.,39,160,10,6,16,6,3358bf58-6990-4e97-8f76-d1a4a25bbad8
