year,session,course,description,scheduled_hours,class_size,lectures,tutorials,labs,other,institution_user_id
2024,Winter,TEST 364,Church so quality home draw herself free.,35,24,11,9,7,2,f82052d4-6608-4bb0-8e0b-60ae0babdfde
2022,Summer,TEST 180,Food next seek reflect least center.,48,123,15,19,14,8,0afac889-a4e8-46f9-834f-2b9f368d2a67
2010,Fall,TEST 493,Throw mean result need.,48,198,11,20,15,7,f331313b-b9f4-4685-bc5b-759c96757b76
2019,Winter,TEST 359,Professional two pull establish rock project rate.,21,82,14,11,14,9,7d325df4-375f-44ee-b72a-0aa097519980
2011,Winter,TEST 439,Arrive however ground four read.,42,81,13,2,8,1,9b717e18-4fd7-4609-a0cd-84a70aa55992
2024,Fall,TEST 393,Hear save prove fly.,36,99,12,4,4,4,fb20e84e-e33d-4ea3-984d-29e6d4543028
2011,Fall,TEST 324,Old around boy style ability.,48,114,15,17,0,6,2284d901-1196-47b3-a671-846565d2e68d
2014,Fall,TEST 489,Note more project condition.,48,56,10,2,14,1,e44eeccb-8db9-41b5-af11-9c107600d5b0
2023,Summer,TEST 414,Paper blue important wife environmental.,38,32,18,13,8,7,c428ffc8-0be7-413c-8018-c56e60dcd2f2
2011,Summer,TEST 106,Campaign oil business best fill way.,23,158,18,8,12,8,c1dd3d29-4142-46b3-bac5-aadd6b5c1d7c
2017,Summer,TEST 372,Agreement newspaper today American.,47,198,17,15,4,8,c428ffc8-0be7-413c-8018-c56e60dcd2f2
2011,Winter,TEST 334,Inside build control commercial chance land company.,30,192,14,9,18,4,92496868-3958-4208-bf7c-f3a023dfa719
2023,Winter,TEST 458,Nice class yet whose shoulder adult.,43,140,13,3,18,6,1cf806bf-f429-47b9-9ee9-551df06b0c3a
2023,Fall,TEST 338,Design his lead yes make.,21,65,10,11,2,8,bc1e08bb-ab1a-4db2-ae17-9426a17b12f2
2014,Winter,TEST 428,Still space door huge check.,20,71,11,8,1,4,02a4d835-35dd-471b-b5b2-f9b4d21744ea
2014,Winter,TEST 216,Miss Mr hotel enter.,32,102,19,2,12,9,4eb301f3-8119-4780-bf91-98a973daf4b3
2024,Fall,TEST 170,Remain health Mrs strong.,31,82,19,19,9,10,538dfd5d-109f-410c-b974-1db33ed0dd58
2012,Fall,TEST 290,Others air true owner nature lay speak something.,26,65,11,20,15,4,3a289c53-7495-4c1c-8de2-a69cda309232
2012,Fall,TEST 254,Check firm bed must stand.,25,55,18,4,5,10,e44eeccb-8db9-41b5-af11-9c107600d5b0
2015,Fall,TEST 217,Could anyone address dream do full.,32,67,20,6,7,3,61b42b56-4a5c-489d-a0c7-ad8afd8ce85b
2020,Winter,TEST 377,Difficult sense budget professional.,20,74,14,13,19,7,4eb301f3-8119-4780-bf91-98a973daf4b3
2014,Winter,TEST 371,Hard successful throw five level task answer.,41,68,12,12,11,8,a4826d9c-7390-4093-bbbe-4ccc877f3c99
2023,Fall,TEST 181,Economic Mrs trouble we get give.,35,85,13,11,9,2,3ff4b31b-8b70-42d8-be05-6b2095fa7f6e
2023,Fall,TEST 172,Marriage idea upon help student.,44,126,18,18,7,5,927da48c-edf6-426a-add0-fe00b623f2de
2018,Summer,TEST 477,Husband authority think impact election simply theory.,45,84,19,13,19,9,ba1d9c49-f6f8-4052-8245-dff2d2e76da6
2013,Winter,TEST 119,Religious baby professor.,46,195,15,19,8,0,cf46a12f-66d6-457b-bf55-91721a00dcb2
2015,Winter,TEST 341,Baby response against.,38,75,15,19,17,2,2284d901-1196-47b3-a671-846565d2e68d
2011,Summer,TEST 441,Share ever article thank professional apply.,44,111,17,19,13,1,a850ec4e-32e0-4345-a838-5f97c6b5ed66
2013,Winter,TEST 232,Capital degree in from lead majority.,47,177,15,18,19,5,59ae2bd5-2468-4dcd-acb4-3f59978048ce
2020,Winter,TEST 139,Reach discuss population conference rule while.,48,90,17,14,12,5,02a4d835-35dd-471b-b5b2-f9b4d21744ea
2020,Winter,TEST 481,Always article hospital experience.,39,129,10,6,13,2,8623e081-d699-4413-81ff-b940255b91d8
2011,Winter,TEST 459,View public matter Mr no agent.,23,185,15,4,11,8,a850ec4e-32e0-4345-a838-5f97c6b5ed66
